{"$schema":"https://json-schema.org/draft/2020-12/schema","$id":"https://voce.dev/schemas/structural-validation-input/v1alpha1","title":"StructuralValidationInput","type":"object","properties":{"schemaVersion":{"const":"voce.structural-validation-input/v1alpha1"},"id":{"type":"string"},"artifacts":{"type":"array"},"outputContract":{"type":"object"}},"required":["schemaVersion","id","artifacts","outputContract"],"additionalProperties":true}
