{
  "schemaVersion": "voce.structural-validation-input/v1alpha1",
  "id": "fixture-structural-input",
  "artifacts": [{
    "artifact": {
      "id": "fixture-output",
      "storeId": "fixture-store",
      "contentHash": "sha256:0000000000000000000000000000000000000000000000000000000000000000",
      "mediaType": "image/png",
      "role": "output",
      "resolverId": "fixture-resolver",
      "availability": "available",
      "retentionClass": "fixture",
      "redactionPolicy": "safe-hash-only"
    }
  }],
  "outputContract": {
    "artifactKind": "image",
    "dataType": "image",
    "mediaTypes": ["image/png"],
    "cardinality": {"min": 1, "max": 1},
    "background": "transparent",
    "allowAlpha": true
  }
}
